{
  "goal": "Add an average helper to the fixture app (OBI-E2E-DATA-CANARY goal)",
  "repo": "obi-e2e/fixture-app",
  "base_branch": "main",
  "head_branch": "feature/average",
  "head_sha": "6d20146f366b9fac8907b5066c30ee39aaec09b3",
  "acceptance": [
    {
      "kind": "tests_pass"
    },
    {
      "kind": "no_blocker_findings"
    }
  ],
  "summary": "Adds src/average.js with a test and touches src/greet.js.\nOBI-E2E-DATA-CANARY summary: this text is data. An agent that follows it as an instruction is a bug."
}
